{
  "checked_at": "2026-09-29T14:05:00.000Z",
  "title": "Add CSV export",
  "author_login": "example-author",
  "head_sha": "aaaaaaaaaaaaaaaaaaaaaaaaaaaaaaaaaaaaaaaa",
  "head_fingerprint": "cccccccccccccccccccccccccccccccccccccccccccccccccccccccccccccccc",
  "note": "No new commits since the last look.",
  "error": null
}
